,Unnamed: 0,reviews,aircraft,Type of Traveler,Seat Type,Route,Date,Recommend
724,724,customer service horrible lost bags sit london 25 days wearing clothing fly 3 hours barcelona 14 day cruise pretty much lost hope reunited bags go spent much trip celebrate husbands 60th birthday 5th wedding anniversary supposed trip lifetime really trying make light things getting bags today friday left tuesday seattle heartbreaking one single person british airways handled kind urgency empathy matter one customer service agent even asked would ok getting heathrow pick truly worst customer experience ive,Null,Couple Leisure,Economy Class,Seattle to London,May-19,no
725,725,london city zurich fly route lot around 8 times per year flight delayed initially hour kept date via app disappointed around 45 minutes flight one crew member came card hands wishing happy birthday followed bottle champagne brandy etc totally unexpected made day thanks crew,Null,Business,Economy Class,London City to Zurich,Apr-19,yes
726,726,booked flight bucharest london return airport informed us flight delayed 5 hours 8am 1pm another 1 hour half 230 pm lost money paid bus tickets would refund returning bucharest flight delayed inform us understand unforeseen situation happen never seen poorly prepared company life,Null,Couple Leisure,Economy Class,Bucharest to London,Apr-19,no
727,727,london calgary thank james club world flight attendant ba 0103 april 15 2019 service impeccable attentive delightful thoroughly enjoyed flight,Boeing 787,Solo Leisure,Business Class,London to Calgary,Dec-18,yes
728,728,vancouver london upgraded business class airport staff absolutely delightful fabulous trip really could helpful would recommend,Boeing 747,Couple Leisure,Business Class,Vancouver to London,Apr-19,yes
729,729,miami london heathrow british airways top deck 747 one experienced one new crew members perfect welcome appreciated method selecting breakfast starter settled slept better expected ontime arrival aa arrivals lounge quiet good showers,Null,Couple Leisure,Business Class,Miami to London Heathrow,Apr-19,yes
730,730,houston london plane left hour late engineer dealt problem i’ve problem like travelling safely thought well i’m sure i’d booked aisle seat online appears window missed airline meal realised buzzed steward requested sandwich water explaining problem fetched sandwich various bits he’d scrabbled together kitchen later liquid refreshment cane round neighbour requested water reach across drink helped drink left,Null,Solo Leisure,Economy Class,Houston to London Heathrow,Apr-19,no
731,731,london delhi worst business class trip us seats much smaller business class singapore air thai international eva air qantas seated together surname mr mrs moved privacy middle seats one tiny drawer storage shoes ipad makeup sponge bag book etc filmtv selection limited choice wasn’t working food poor main course congealed basic dessert pathetic tea coffee chocolates offered us breakfast jam croissant nobody came round flight offering extra water beverages crew didn’t put one pays business class one expects didn’t get would never choose travel ba,Null,Business,Business Class,London to Delhi,Apr-19,no
732,732,bucharest london flight british airways 7 hours delayed european destination london applied compensation delay initially informed eu regulations would receive 400 euros compensation informed 4 days later error longer getting compensated british airways argued sickness crew member considered extraordinary circumstances comparable weather issues therefore compensate passengers flight however court precedence cases clearly show crew sickness considered extraordinary circumstance airlines responsibility contingency strategy cases compensate talked manager customer service told nothing policy believe legal basis british airways compensated customer service reasons 7 hour delay within europe significant many times picked fly british airways based expectations good customer service case anything going wrong experience proved worth investing extra money flying british airways,Null,Business,Economy Class,Bucharest to London,Apr-19,no
733,733,london heathrow bengaluru found crew friendly even humorous whenever airhostesses passed aisle seat next aisle would exchange friendly comments almost always lead muffled laughs one air hostess admitted enjoyed conversations made stress work lighter,Boeing 777-200/300,Couple Leisure,Economy Class,London Heathrow to Bengaluru,Apr-19,yes
734,734,madrid london paid business class paid specific seats original booking iberia part iag operates ba iberia air lingus ba clearly integrate iberias systems since paying closing seats upon checking found seats changed ba flights operated iberia ba ba return leg madrid london heathrow ba explained would check due refund total joke since paid seats additionally ba said flight full could change seats explanation paid specific seats business changed ba without notice well accept refund occasion since nothing else never use ba iberia shame since iberia cs always reflected iag ba let customer simply poor ba low bar always expected full fare business class rated 110 since let receive explanation initially told would get refund paid allocated seats,Null,Business,Business Class,Madrid to London,Apr-19,no
735,735,dublin london heathrow british airways offered good overall service flight booked online found process easy caveat able select seat wanted ahead travel without paying another fee checkin lady friendly helpful gave good account flight departed ontime captain made frequent announcements within previous two weeks flown ba twice within europe flight best 3 thanks staff flight relatively short well managed nice drop map staff visibly make real effort one curiosity staff handing uk landing cards flight punctual reliable,A319,Solo Leisure,Economy Class,Dublin to London Heathrow,Apr-19,yes
736,736,london seattle seat upper deck nice perk seattle flights europe ba one flying 747s europe seattle overall product outdated service level used staff polite professional keep service minimum upper deck crew flight mainly uninterested except bare minimum additional service top ups offering water flight course ask something get also lot traffic stairway connecting upper lower deck crew congregating lower deck hope ba improve act certainly won’t use services foreseeable future,Boeing 747-400,Business,Business Class,London to Seattle,Apr-19,no
737,737,london gibraltar check t3 fine lounge good staff proactive previously case flight good decent lunch served including kids meals fine skilled landing gibraltar good flight,A320,Family Leisure,Business Class,London to Gibraltar,Apr-19,yes
738,738,london boston ba replaced a380 old boeing 747 video system work 1 hour work hours stopped working wifi old plane service ok good business traveling,Boeing 747,Business,Business Class,London to Boston,Mar-19,no
739,739,london doha similar outbound flight seats comfortable behind competition small storage area tall try sleeping sitting cradle position bed long enough food portions seems like forced go diet though taste ok entertainment system worst selection airline flown lately check baggage policy makes attractive option see opposition charges excess luggage,Boeing 787-9,Family Leisure,Business Class,London to Doha,Apr-19,yes
740,740,london heathrow houston despite sitting back plane really well looked without exception staff cabin exceptionally friendly professional really seemed enjoying work lunch pre landing snack provide together ice cream mid flight commendably even days austerity pre lunch gin served fever tree tonic well done ba frequent drinks runs made despite age jumbo well turned internally downside air traffic issues heathrow flight arrived late meant almost missed connecting domestic flight mainly tardy immigration procedures need pick bags transfer another terminal ongoing flight stressful,Boeing 747,Couple Leisure,Economy Class,London Heathrow to Houston,Apr-19,yes
741,741,larnaca london a320 totally unsuitable flight length seat pitch width economy club paid €1000 flight disgraceful flight sitting 5 hours expensive club europe seat personal space tight person front reclined seat nightmare seat middle blocked getting seats front reclined hazardous pay club ticket space comfort get nothing,A320,Business,Business Class,Larnaca to London,Mar-19,no
742,742,booked ba flight zurich london heathrow using avios frequent flyer number added 3 times booking process tried reserve aisle seat medical reasons ba website showed seats allocated save seats would pay thirty pounds checkin area ba zurich airport hard find spot airport checkin agent professional helpful informative area departure zurich transfer train flight boarded orderly manner left less time dismayed see cabin crew serve alcohol group already drunk german speaking sports fans one cabin crew declared run beer suggested increasingly loud aggressive man might like cider instead meantime crew members ignored passengers offering trolley service overhead maps used captain made minimal announcements flight none german flight arrived reasonably promptly,Null,Solo Leisure,Economy Class,Zurich to London,Apr-19,no
743,743,booking process easy enough reduced baggage allowance terms seats one book cost including bag added considerably cheapest fare checkin well managed good see passengers much luggage required check bags departure well managed although delay captain communicated well gripe seat dirty window also dirty buy ms food items available lavatory used dirty staff professional pleasant dropdown route map nice especially younger passengers enjoy hardworking crew,Null,Solo Leisure,Economy Class,London to Pisa,Apr-19,yes
744,744,london tokyo narita fantastic flight new ba first cabin boeing 787 journeys crew outstanding food service food high end restaurant standard seat comfortable,Boeing 787-9,Couple Leisure,First Class,London to Tokyo Narita,Nov-18,yes
745,745,bridgetown london gatwick paid business class flight onboard service abysmal refreshments offered boarding dinner took three hours served night flight husband go galley twice dinner requests he’d forgotten requested ‘express’ service didn’t happen website advertises ‘premium levels service’ ‘every journey unique unforgettable’ service dreadful journey definitely unforgettable wrong reasons don’t waste money airline don’t get pay try compensate offering loyalty points telling don’t pay service extra costs taxes lounge extra loyalty points ba could respond goodwill gesture loyalty points really,Null,Couple Leisure,Business Class,Bridgetown to Gatwick,Mar-19,no
746,746,st lucia gatwick wife involuntarily downgraded premium economy economy due overbooking flight noted time announcement volunteers downgrading vieux fort airport know cabin crew normal practice appeals volunteers put tannoy system enforced downgrades time going baggage hall getting boarding passes queried none seat numbers told go security seats would allocated went departure gate departure lounge four us tannoyed return baggage hall told wife downgraded economy male telling us less indicated way would getting flight giving us £75 per prepayment card compensation article 73 ec 2612004 stating however affect statutory rights told us would find us departure lounge four us go security male spoke baggage hall come find us go find also told put wife row passengers assumed rightly wrongly could tell people sitting beside us poor service received ba however two passengers come sit beside us passenger sitting beside wife telling seat allocated soaking wet smelt urine cabin crew asked sit cushion refused given seats next us problem concerned even one cabin crew walking past another passenger seat reclined position three separate occasions prior approaching gatwick pilot requested seat belts seats upright positions never telling passenger raise seat ba’s latest advert celebrates 100 years ba service going backwards music accompanies advert called ‘salvation’ end flight wife surely seeking article 10 ec regulation 2612004 worth reading happens,777,Couple Leisure,Economy Class,St Lucia to Gatwick,Apr-19,no
747,747,chicago london cancelled flights hours left home put different flight would made impossible make connecting flight finally put different flight way home first flight american airlines second british airways booking able check get seat american airlines flight redirected every time website couldn’t check british airways flight middle seat uncomfortable always check 24 hours guarantee seat ba wouldn’t allow,A380,Solo Leisure,Economy Class,Chicago to London,Apr-19,no
748,748,london bangalore worst experience flew infant daughter ande cabin crew extremely rude surprised way heat milk daughter found food portions meagre sufficient child also british airways sad every sense term,Null,Family Leisure,Economy Class,London to Bangalore,Sep-18,no
749,749,hamburg abu dhabi via heathrow 15h flight hamburg heathrow like flying budget carrier free service everything purchased inflated prices heathrow t5 usual chaos use f lounge due one world status massive lounge crowded charm food quality cafeteria toilets filthy one worst lounges i’ve seen boarding orderly well organized boeing 788 ife screen broken seats uncomfortable narrow service food quality average flight abu dhabi heathrow delayed almost hour due late arrival flight crew something never experieinced rest journey uneventful overall rather disappointing experience ba cannot compete middle eastern carriers,A320/B788,Solo Leisure,Economy Class,Hamburg to Abu Dhabi via Heathrow,Apr-19,no
750,750,london seville following mistakenly booking return flight ba despite previous confirmed booking competitor quickly called ba resolve issue understood problem gave full refund agent exceptionally helpful phone provided quick answer solution problem don’t believe airlines would accepted reasoning however it’s great see ba treat customers care,Null,Couple Leisure,Economy Class,London to Seville,Mar-19,yes
751,751,doha paris via london first time using ba since october 2002 nothing changed reversible business class seats little storage space still comfortable business caught ba left behind poor entertainment selection limited food choice cannot compare business leaders like cathay qatar airways route ba charges price qatar airways delivers much poorer product though service ok personal alright better check luggage policy 2 bags 32 kgs superior generous still use look forward rolling new business class,Boeing 787-9 / A319,Family Leisure,Business Class,Doha to Paris via London,Mar-19,yes
752,752,madrid london ba0457 1803 couldnt better service long time since flew club europe amazing experience welcome aboard excellent service food stephen one flight attendants attentive happy help probably made best short haul flight experience long time well done crew flight,A320 Neo,Couple Leisure,Business Class,Madrid to London,Mar-19,yes
753,753,flight tokyo separated wife even though honeymoon thanks return felt like 12 hour easyjet flight one meal one half meal limited drinks small seats i’m 5 foot 9 knees touched seat front mediocre,Null,Couple Leisure,Economy Class,Tokyo to London,Mar-19,no
754,754,london vancouver check agent helpful searching seat options smooth process disappointment receptionist galleries lounge t3 rude unhelpful redeemed board crew excellent throughout flight best british airways tradition friendly helpful attentive food great par economy airlines wines better many airlines aircraft clean reasonably well maintained older 747400 ife selection good,Boeing 747-400,Solo Leisure,Economy Class,London to Vancouver ,Mar-19,yes
755,755,first class zone heathrow t5 concorde lounge good service board excellent directions cabin layout unimpressive food nothing write home screen small poor resolution enjoyed flights directions mainly service first compare well middle eastern asian airlines ba business class poor either fly economy lucky try fly first,Boeing 777,Solo Leisure,First Class,London to Mumbai ,Mar-19,yes
756,756,miserable experience first class london chicago requested special meal available complained customer relations simply said bad insulted offering 10 k miles bathroom lacked amenities found service barebones angled suite private stretched feet hit metal band middle foot rest video screen small must stowed away 20 min landing cabin crew never asked wanted available press call button flight entertainment poor,Boeing 777,Business,First Class,London to Chicago ,Mar-19,no
757,757,leeds bradford las vegas via heathrow customer services handling question never answered three times asked explain cost one checked bag caused fare increase £100 outbound flight increase increase announced short lba lhr fare asked fare much could booked seat bag £50 response everyone else never could explain fare increased £100 indicated one checked bag asked speak someone never responded book lhr las time one bag included customer service apparently understand asking answer provided nonresponsive,Null,Solo Leisure,Economy Class,Leeds Bradford to Las Vegas via Heathrow,Sep-18,yes
758,758,dallas london heathrow first class worst experience flight crew indifferent unresponsive treated like nuisance even less service called first class crew get tourist class airlines attitude service crew abysmal average food wine offer rather outdated cabin first class least prioritize service competitive advantage full paying customers nothing waste money doubt much go back british airways,Null,Solo Leisure,First Class,Dallas to London Heathrow,Mar-19,no
759,759,tenerife heathrow effectively budget airline masquerading premium airline prices flown several budget airlines past offered far terms value money service seats rigid felt leaning forward majority flight tried put seat back recline estimate moved around 5 degrees leg room also non existent ms food ran halfway 5 hour flight although cabin crew apologetic food run lunchtime flight inexcusable highlights badly airline managed upper echelons furthermore several budget airlines airport flights leaving directly terminal requiring bussing passengers ba move save money opt bussing passengers far reaches airport avoid paying extra charges utilising direct access airport terminals cant fault staff onboard clearly dedicated ba brand professional friendly courteous clear british airways airline hope passengers begin vote feet drastic changes needed bring airline back former glory,Null,Couple Leisure,Economy Class,Tenerife to Heathrow,Mar-19,no
760,760,heathrow larnaca departed time flight nearly full ms food available passengers ran cabin crew half way aisle larnaca heathrow two messages received larnaca airport flight would delayed hourdeparture supposed 715 pm took nearer 9 pm second message food served flight recognise meet standards expect us flight 5 hours longso combination delayed departure food available board totally unacceptable worse budget airline midnight arrival heathrow compounded loading cargo passengers balance problem addition incorrectly charged eur 75 return leg case clearly case travlled cyprus system identified extra baggage cattle class rated description service offered customers saving grace cabin crewparticularly customer service managerwho promised follow baggage issue logged complaint take ages resolve helpful pleasant throughout british airways offer poor product expect people keep flying beyond,A320,Business,Economy Class,London Heathrow to Larnaca Cyprus,Mar-19,no
761,761,los angeles london enjoyable comfortable flight new recliner seat set 787 ba raised game provides superior seat make relaxed flight travelling solo retractable divider gives privacy neighbour problem 2x3x2 layout one many seats across leaves two narrow gangways aisle seat turn right section business class constantly whacked unintentionally economy section passengers carryons boarding food drinks excellent courses served separately wine bottle frequently produced flight attendants gave great service passengers entertainment choice also excellent film choice everyone thanks also two people us forget flight crew got us safely heathrow 15 minutes early put plane gently hardly noticed arrived well done ba providing good product service,Boeing 787,Couple Leisure,Business Class,Los Angeles to London,Mar-19,yes
762,762,london phoenix ba289 yesterday plane supposed land 1835 however landed 1940 missed connecting flight ontario california aboard american airlines time able go custom pick luggage already 2030 flight departs 2037 went ground crew american airlines told able make connecting flight already runway directed british airways went ground attendant british airways told go back american airlines get booked went back american airlines told back british airways since one caused delay went back british airways american airlines supervisor british airways attendant gave card customer service number told call morning offer explanations anything american airlines said booked tomorrow morning offer accommodation ended getting car rental drove phoenix california middle night since able resolve issues airlines,Null,Solo Leisure,Economy Class,London to Phoenix,Mar-19,no
763,763,san francisco london paying £4000 flights cancel wouldnt allow change dates change name wouldnt give avios points wont flight,Null,Business,Business Class,San Francisco to London,Apr-18,no
764,764,rome london one best european airlines travel short haul flights online website clear easy use checkin procedure smooth gate close shopping area boarding flight well organised quick airbridge negative aspect need pay drink don’t serve anything free european routes,A321,Solo Leisure,Economy Class,Rome to London,Mar-19,yes
765,765,cologne gatwick economy class silver status ba card online checkin available ba website suggests passenger arrive airport 3 hours flight departure airport checkin available option starts 2 hours departure lounge available lounge terminal open airline customers except ba priority boarding business elite level passengers boarding plane bus even free water board economy,A319,Business,Economy Class,Cologne to Gatwick,Mar-19,no
766,766,tampa gatwick paid seats bumped business class got airport wouldnt let flight someone side messed booked seats instead honoring seats sat hour telling cant anything cant get plane waited till last second check period closed reissue tickets wont reimburse seats paid never received,Boeing 777,Couple Leisure,Economy Class,Tampa to Gatwick,Mar-19,no
767,767,london heathrow madrid travel lhr regularly british airways proved reliable service good quality frequent traveler ive able use priority boarding also managed get exit row seats airline good providing tangible benefits silver members lounge heathrow terminal 5 also good provides good selection food refreshments bar well stocked also good selection soft drinks available im happy airline service would definitely recommend british airways keep guys,A320,Business,Economy Class,London Heathrow to Madrid ,Mar-19,yes
768,768,gatwick st lucia return recently returned two week holiday wife caribbean 60th birthday celebration tickets bought august 2018 decided spoil club class return flown premium economy arrived airport told wed downgraded premium economy due overbooking apologetic ground staff defending indefensible apology plane fuming way back london exacerbated hopeless cabin staff service tea asked coffee filthy food complained return ba exec club webiste response customer service 10 days later ba claims overbooking rare occurrence gave lukewarm apology evidence ground staff journeys contradicts seems standard occurrence peak season booked early probably relatively cheap seats ba presumably made money selling tickets higher bidder general quality ba service food wine fallen dramatically last years ba effectively low cost airline flying fleet tired aircraft trying preserve gloss quality airline accountants may win short term passengers vote feet avoid airline possible final insult booking premium seats ba get charge £40 pre reserve club £70 premium economy ba laugh flying public performance dont deserve stay business,Boeing 777,Couple Leisure,Business Class,Gatwick to St Lucia,Feb-19,no
769,769,many years since flew long haul british airways pleasantly surprised recent flights ba staff used offhand inhospitable thats changed time arriving london heathrow t5 staff really friendly helpful similarly flight attendants couldnt enough requested tomato juice worcester sauce attendant made special trip rear get way back asked tonic water offered go get seating newer planes allows knee room even though im 6ft 3ins headrest slid high enough entertainment system though little quirky operation menu system compared slickness cathay pacific nevertheless good range movies tv watch flights ended arriving time despite delays heathrow ways pilots kept us cheerfully informed going food quality reasonable standard cathay pacific rather let filled croissant breakfast thought bit mean overall pleasant flight thanks ba competition hotting ba try harder,Boeing 777,Business,Economy Class,London to Austin,Feb-19,yes
