,Unnamed: 0,reviews,aircraft,Type of Traveler,Seat Type,Route,Date,Recommend
0,0,worst experience life trying deal customer service british airways many issues getting one destination absolutely horrible time trying get answers reach anyone capable helping navigate uncertainties wrote formal complaint requesting type refund received generic “we sorry” email 5000 avios attached equivalent maybe 50 600 flight needless say go waste refuse fly untrustworthy incompetent unorganized airline couldn’t even address one single issue expressed equivalent handing band aid slapping face say flight smooth onboard staff kind attentive frustrating thing customer service trained give runaround heavily point exhaustion give trying take loss,Null,Family Leisure,Economy Class,London to Denver,Mar-23,no
1,1,due code sharing cathay pacific downgraded ba return leg can’t describe cheated felt booked paid airline great entertainment food service instead forced go hungry one choice meal inedible ensure passengers didn’t get funny ideas assume vegetarian option unavailable might given cracker small packet nuts cabin crew announced uniquely aggressive dismissive way “you won’t get anything else 12 hours know” entertainment compiled mainly b movies paid £11 wifi could watch netflix laptop unsurprisingly signal weak couldn’t even send email add insult injury earbuds provided cheapest lowest quality ever seen since last time used airline crew less rude obnoxious impatient unhelpful don’t understand seems british airways look characteristics desirable attributes crew,Null,Solo Leisure,Economy Class,Hong Kong to London,Apr-23,no
2,2,lhr check quick first wing quickly security first lounge quiet change reasonably good breakfast buffet available ba brought back highlife magazine lounge seems used covid scrap magazines used offer part endless ba cost cutting toilets lounge disgusting ever cleaned frequently visit 20 years date public washrooms t5 better cleaner boarding usual ba muddled mess two gate staff appeared clue endless announcements gate full flight requesting passengers check bags get flight less 40 full onboard good welcome captain flight left gate 5 mins late breakfast 3 choices fair standard hot towels even packet towels offered club europe another part relentless ba cost cutting wouldnt mind fares proportionately lot higher pre covid cabin staff service perfunctory best scrap recognition ba gold oneworld emerald members clear proof ba really dont care breakfast trays cleared 45 mins flight sign staff stay front galley rest flight paid £499 1 hours wifi dropped connection next 40 mins sad note staff service ryanair pro active nowadays priority tagged suitcase came nearly last malaga standard ba business class baggage handling waste money club europe standards keep dropping,A320,Business,Business Class,Heathrow to Malaga,Apr-23,no
3,3,wouldnt recommend british airways tried call customer service 3 times different days time waited 30 minutes phone ended hanging excusing high volume calls write email still waiting 2 weeks website difficult navigate easy really invoice proof receipt look another service sent online dont receive pdf file need proof flight need screenshots flight flown access booking reprint document try create pdf need contact customer service online long waiting time wait week receive expensive poor almost inexistent customer service difficult use website airline definitely wouldnt recommend shame 2023 still position sleeping competitors around,Null,Family Leisure,Economy Class,Santorini to Gatwick,Mar-23,no
4,4,absolutely horrible experience booked ticket expedia british airways operated flight madrid belfast changeover london heathrow whole itinerary listed ba although madrid london flight iberia jan 22nd london experiencing cold fog iberian flight sat tarmac 2 hours madrid london weather upon landing terminal 3 take bus terminal 5 flight last flight belfast evening already taken ba desk swamped people many people spend night due weather british airways staff said could go book hotel 200 pounds would reimbursed barely able find room take expensive cab however trying get reimbursement ba said wasnt problem iberias problem iberia said reimburse due weather complaining ba said market flight ba refuse reimburse absolutely disgusting behavior airline take responsibility flight using name sell people dont want take responsibility expect take bus back terminal 3 people gave false information,Null,Solo Leisure,Economy Class,Madrid to Belfast via London,Jan-23,no
5,5,worst airline one thing went right don’t understand got bad late take gate arrived bags took 40 minutes arrive horrendous,Null,Business,Economy Class,Dublin to London,Apr-23,no
6,6,never fly british airways start plane 2 hours late weather reason given boarding process chaotic airport onto plane importantly although business class wasn’t really business class aisles —not separated way—in simply put tray middle seat one sits seats like rest extremely cramped uncomfortable could believe called business class,Null,Couple Leisure,Business Class,London to Venice,Mar-23,no
7,7,worst aircraft ever flown seats cramped uncomfortable considering flights cost well 1000each expected little space money husbands knees rubbing seat front 10 hour flight acceptable food disgusting inedible hot food breakfast vile would entertain using ba ground staff great it’s seating food offer lets airline expected much,A350,Couple Leisure,Economy Class,Las Vegas to London,Apr-23,no
8,8,enjoyed flight boarding swift service friendly professional food selection good enjoyed quality one downside landed issue ground crew ready t5 total landing getting doors open took 30 minutes believe heathrow t5 strike action week,A320,Solo Leisure,Business Class,Faro to Heathrow,Apr-23,yes
9,9,make hard lounge experience staff taking care boarding treated us disdain bordering contempt can’t training would fear anything happening “new” club world suites huge step old product really deliver comfort privacy crew professional personally found food menu rather odd essentially one main could handle told ran rows,Boeing 777,Couple Leisure,Business Class,London to Atlanta,Apr-23,no
10,10,several delays canceled flights finally made copenhagen american airlines british airways flights luggage destroyed wheels torn buy new luggage denmark made claim british airways reimburse didn’t receipt old luggage would cover 50 new luggage advice receipts old luggage prior flying don’t get ripped like,Null,Couple Leisure,Economy Class,London to Copenhagen,Apr-23,no
11,11,literally worst flight life booking tickets together partner separated ‘sorry flight full’ flight took 45 minutes late apology trolley service took two hours periodically skipped rows response flippant rude ‘whoops sure happened want’ genuinely appalling beginning end might well fly easy jet least charge price commensurate poor quality service like ba,Null,Couple Leisure,Economy Class,London to Malta,Apr-23,no
12,12,swore would never fly ba messed much trying get budapest times flights suited decided give another go flight left time cabin clean staff friendly even complimentary teacoffee breakfast bar economy flight pleasant enough cant think negatives write flight service certainly head shoulders trip easyjet,A319,Couple Leisure,Economy Class,Belfast to London,Apr-23,yes
13,13,obviously many airlines gone downhill recent years prices increased services gone disappointing thing ba aspects really don’t need get worse check staff heathrow downright rude abusive shouting passengers line rolling eyes passengers get confused constant shouting bullying airlines competing globally behaviour particularly noticeable asia service industry next level wouldn’t want suggest staff like many younger employees polite helpful however couple older staff downright rude obnoxious,Boeing 787,Business,Premium Economy,London to Hong Kong,Apr-23,no
14,14,lost 3 4 checked bags denied wheelchair assistance lhr wife staff forced us change terminals foot rude staff ba297 lhr ord april 05 2023 ignored multiple times simply requested cup water walked couple attempts request water politely ba staff onboard yelled wife asked go back seat horrible flight disappointing staff customer service terrible online checkin never worked ba never verified covid documents uploaded advance resulting wife seated separately i’ve lost respect british airways disgusted,Null,Family Leisure,Economy Class,Mumbai to Chicago via London,Apr-23,no
15,15,flown ba many years time 10 years ago getting better sadly trip underlines slipped versus airlines booking time one scammed extortionate amount book seat heathrow t5 check queues unbelievably long staff bag drop curt say least lounges remain awful overcrowded ba invested many years flight food okay although portions kept minimal one days crew could give damn service mostly absent entire flight next time change ceo better recruiting aa second rate budget irish airline,Boeing 777,Business,Business Class,London to New York,Apr-23,no
16,16,boarding mumbai chaotic badly organised board crew announcements professional relaxed informative typical ba style seat quite comfortable refurbished aircraft padding materials quite good lucky middle seat empty didn’t suffer new narrow seat think would made lot less comfortable ife excellent responsive good quality enormous selection tv movies good number games wifi also good quite netflix quality still reasonable don’t think £1799 full flight bad value pay less want short term simple messaging cabin crew good friendly efficient catering reasonable although near 10hr flight small tasty pastry second meal service wasn’t really enough landing processing heathrow astonishingly quick felt like 3am even though 630pm queues waiting even baggage super quick coming overall solid experience economy significantly better used,Boeing 777-200,Solo Leisure,Economy Class,Mumbai to London,Mar-23,yes
17,17,verified mexico city airport zoo taking late departure ba lhr isnt bad club passengers use aa admirals lounge surprisingly good busy seems cater bas club passengers time day lovely staff solid food bar really pleasant flew older 787 old style club seats seated front cabin 3 rows club window adjecant aisle seat really good travel partner come think really miss old style cutting edge layout better way fly couple last row front cabin window aisle seat unobstructed access aisle still terrible pay seats obvioulsy works happy getting seats flying ba crew good amazing service impecable flight right mix humor service attention food seemed good well hardly touched fine sleeping old club world seats although bedding could better time departure smooth flight early arrival heathrow went outside smoke returned terminal fast track security lhr always terrible today security staff busy chatting among bags went without secundary checks lovely shower spa fabulous facility south lounge crazy busy design disaster ever choose bizarre combination furniture mess food offer solid drinks home stretch amsterdam pretty straight forward lousy welcome door crew recovered well made everyone feel special excellent barcart service love doubleservings drinks english tea worst meal concepts world really dont understand ba stuck years noone like cucumber white bread things hey time landing amsterdam usual long taxi clumsy jet bridge connection ended 20 minute late arrival hard connect jetbridge amsterdam flying club ba still wonderful love,Boeing 787 / A320,Couple Leisure,Business Class,Mexico City to Amsterdam via London,Mar-23,yes
18,18,poor service frustrating firstly flight lhr cancelled 16 mar23 got text message inform information desk unable confirm correct scam confirmed went counter get new boarding pass counter informed coach leaving 15mins hotel fellow travelers waited 45mins one coach stand guide us answer questions transfer hotel 30 mins away airport got hotel around 1015pm staff informed dinner closes 1030 rush appeared motel hotel room smelling weed nonsmoker uncomfortable although wanted compromise rest went wash face tap sink came hands panicked asked reception staff change room discussion agreed change went alternate room horror occupied asked staff call cab left,Null,Business,Economy Class,Barcelona to London,Mar-23,no
19,19,generally poor sent gate time sat maybe 30 minutes announced crew familiar a321 would delay clearly nonsense retraction board statement watched crew walk gate impression want given miniscule amount water small bag pretzels announced would wait cabin service card processing machines us updates sight crew next two hours attempted charge us even glass water said complimentary girl said problem walked away,A321,Couple Leisure,Economy Class,London to Lanzarote,Mar-23,no
20,20,ba changed prepaid seats last minute charged us select new seats flight took late cabin crew served tiny packet pretzels arrived heathrow late put remote stand loaded onto buses terminal held transit security clown member staff allowed 15 passengers time trial queued security 20 minutes,Null,Couple Leisure,Economy Class,Marrakech to London Heathrow,Mar-23,no
21,21,flew london heathrow marrakech ba changed pre paid seats last minute even charged us select seats boarding chaos staff rude demanding selected passengers put hand luggage hold one small bag however never demanded passengers 23 bags hand luggage obviously big flight late taking snack miserable tiny packet cheese pretzels airline going downhill rapidly,Null,Couple Leisure,Economy Class,London Heathrow to Marrakech,Mar-23,no
22,22,meant fly january algeria paid £300 ticket days meant fly wife broke foot rebook march pay another £100 called british airways 3 weeks flight march told rebooked wife still well told don’t pay anything get rebooked sent letter hospital saying wife wasn’t well however never sent ticket made wait nearly 4 weeks asked pay either £316 top £450 paid previously second option gave get refund £80 tax found ridiculous told pay fraction money previously paid time call hang continue telling pay £360 made complaint nothing happened,Null,Family Leisure,Economy Class,London to Algiers,May-22,no
23,23,flown repeatedly british airways one world alliance last weeks every flight delayed back airport miami another massive delay miss connecting flight finally luggage arrived puerto rico 3day delay reschedule round trip havent received information luggage day luckily checked airport last delayed flight meant cabin crew miss connecting flights plane cant anything wir sind den letzten wochen immer wieder mit britisch airways und dem one world zusammenschluss geflogen jeder flug war verspätet nun sitzen wir wieder miami flughafen und haben schon wieder eine massive verspätung sodass wir unseren anschlussflug verpassen werden zuletzt ist auch unser gepäck mit 3 tagen verspätung puerto rico angekommen und wir mussten unseren rundreise umplanen… wir haben bis heute noch keine info über unser gepäck erhalten zum glück haben wir selbst flughafen nachgesehen und es war da… beim letzten verpspäteten flug meinte die kabinen crew dass auch sie ihre anschlussflüge verpassen und wir im selben flugzeug sitzen und sie können nichts machen,Null,Couple Leisure,Economy Class,Miami to Munich via London,Mar-23,yes
24,24,horrified extremely small seats poor training crew clearly receives one exuded kind warmth expressed desire make journey pleasant seats narrow regardless size neighbors forced touch constantly seat front reclined choice recline else breathing head scalp person front food revolting dont even provide napkins unless ask premeal drinks secondary meal last time flew ba completely experience sorry see far quality level slid really majorly disappointing regret already purchased 2 intercontinental trips company see change pathetic 250 ml bottle water sip shorter flights seats couldnt even reclined great pity since flight delayed almost 3 hours wait board,Null,Business,Economy Class,New York to London,Mar-23,no
25,25,worst cabin experience ever cramped seats low cost style uncomfortable could suit short flights 5 hours service catering also shame 250ml water chocolate bar 5 hours service never fly ba,A321Neo,Couple Leisure,Economy Class,Cairo to London,Mar-23,no
26,26,first time flying british airways first time flying americas india via london heathrow chose premium economy reasonable price quite comfortable however first leg flight mumbai heathrow plane bit outdated foot rest second leg heathrow nassau plane brand new premium economy seat pop leg support much comfortable cabin service fine appreciated didnt come cabin often everyone sleeping meals werent great honest landing heathrow wait tarmac 45 minutes waiting open gate connection less hour long ba staff heathrow airport helped move security quickly made time spare next flight arrived nassau found luggage didnt make due short connection time london ba baggage representative nassau extremely professional took claim luggage arrived next ba flight days later british airways nassau representative delivered charter airline shipped island staying impressive efficient,Boeing 777,Solo Leisure,Premium Economy,Mumbai to Nassau via London,Mar-23,yes
27,27,latest affront stood first class line hour finally go front ba agent let 4 supposed vips 1214 large tobechecked bags front us arrogant unapologetic add long list postcovid disappointments done ba,A380,Couple Leisure,First Class,Johannesburg to London,Mar-23,no
28,28,booked flight return flight london munich 311 317 december return flight cancelled rebooked 317 312 british airways notified first change second getting flight reinstated took multiple phone calls occasions time needing find helpful representative british airway employees told even though cancelled flight refund ticket tried charge 800 change fee repeatedly calling back british airways reinstated 317 flight 220 36 make sure get changed checked status ticket daily 312 315 intact days 316 time checkin flight gone airport staff british airways checkin counter ba employees cannot help resolve problems ba representative munich airport confirmation documentation british airways value left stranded airport,Null,Solo Leisure,Economy Class,Munich to London Heathrow,Mar-23,no
29,29,tried check line informed possible given reason telephoned ba customer service must wasted nearly 2 hours given wrong phone numbers incorrect information staff need customer training better knowledge product manners ba customer service virtually non existent never fly,Null,Couple Leisure,Economy Class,Amsterdam to London,Mar-23,no
30,30,catalogue failures flew belfast heathrow week ago flight delayed three half hours missed onward air canada flight calgary result arriving calgary rerouting via vancouver added 6 hours journey met passengers also missed air canada flight british airways flight manchester also delayed several hours way home find heathrow belfast flight already cancelled put back 2 hours delayed another 2 hours avoid british airways like plague,Null,Couple Leisure,Economy Class,Heathrow to Belfast City,Mar-23,no
31,31,flight dubrovnik painful time 630 morning london gatwick easy airport get hour especially airport minimum 2hrs ready board understand likes easyjet ryanair wizzair fly odd times utilise cheaper slots airports seems odd choice ba given people like us fly choose based quality price alone outbound lgwdbv boarding fairly quick easy efficient took time pilot announcements clear professional inspired confidence something appreciate expect ba pilots aircraft clean recent refurbishment program yet advantage pinnacle seats economy still padding adjustable winged headrests better comfort complimentary harrogate mineral water given usual premium touch complimentary snack nutrigain bar poor premium however cabin crew felt unpolished presentation behaviour messy illfitting uniforms unclassy makeup toilets clean maintained appreciate antibacterial wipes kept available postcovid inbound dbvlgw reason online app checkin available despite dubrovnik airport modern airport state art facilities queue manual checkin though ground staff warm friendly helpful proactively offered take larger handluggage hold free charge decided keep us would dash train home airport trains end cancelled already understand delay flight inbound flight day took time landed time also travelled dubrovnik season airport empty hour services available solely flight taking evening passengers terminal time including us take flight boarded time sat gate 15 minutes reason truly bizarre ba managed take late services airport operating live solely purpose enabling flight take pilots flight unpolished unclear announcements flight one couldnt even remember flying back apology delay cabin crew bit smarter presented seemed approachable harrogate water given worlds tiniest bag pretzels complimentary seats flight horrendous new slimline ones ba installing row 14 onwards seats barely padding hard also headrests hard get comfortable landed 55 minutes late gatwick apology given lucky catch last uncanceled train home otherwise wed stranded hours wed spent half hour circling gatwick missed original landing slot given 7 context shorthaul market thats deserve fly ba dont fly lowcost carriers many bad experiences measure good least bad option given 1 point extra solely giving something complimentary onboard,A320,Couple Leisure,Economy Class,Gatwick to Dubrovnik,Mar-23,yes
32,32,could give minus rating would supposed lhrams 1405 13th march get lhr 1200 email say flight cancelled one able help lhr said use app halfway sensible option lcyams 1705 taxi trains lhr working ok bas fault get lcy showing cancelled screen check app rebook via app 1530 departure go desk drop bag told standby flight guarantee seat despite app telling confirmed 1835 ams already overbooked moved onto 1930 flight rotterdam 1530 1835 cancelled anyway happened eventually took best thing say landed intact return amslhr similar story arrive ams screen shows 2100 cancelled quickly check app confirmed emails texts nothing rebooked via app 2200 departure could worse desk agent helpfully printed boarding card app unable issue anything rebooked flight overall dreadful dont care hide behind apps automated call centres avoid unless option even stop consider really need go,Null,Business,Economy Class,London Heathrow to Amsterdam,Mar-23,no
33,33,plane hour late leaving problem happen arrival heathrow plane sits runway 45 minutes free stand go stand waited another 45 minutes bridge available enable us get plane pathetically inefficient,Null,Solo Leisure,Economy Class,Zagreb to London Heathrow,Mar-23,no
34,34,flying world traveller plus premium service premium travelled many airlines lucky enough fly premium times bas premium worst come across flight heathrow jfk ok flight back plane used old dirty uncomfortable two broken seats four one would recline one reclined without using button ba needs look premium service offer exactly instead trying cut costs fallen far behind competitors preferred airline try avoid costs would rather pay fly someone else,Null,Couple Leisure,Premium Economy,New York JFK to Heathrow,Mar-23,no
35,35,literally one worst experiences haven’t airport since began orlando flying back flight plan system went stuck tarmac 6 hours poor customer service ignored times missed connecting flight told leave baggage area without bags even though booked dublin another 4 hours told bags lost continue desk book flight another hour later handed card number told ring cut three times told wouldn’t able get home day despite several flights available booked flight lost suit presents christmas missed engagement party,Null,Solo Leisure,Economy Class,Dublin to Orlando via Heathrow,Dec-22,no
