,Unnamed: 0,reviews,aircraft,Type of Traveler,Seat Type,Route,Date,Recommend
246,246,flew barbados 16 march ba 255 new club class suite huge improvement old yin yang club class unfortunately endured way back comfortable big tv screen high quality picture good headphones plenty nooks crannies storing small items private nice friendly fas called name pretty good drinks service good dinner served let poor best choice movies inflight entertainment system thank goodness latest james bond movie showing took landed time smooth flight one letdown usual extortionate fee charged prebooking seat come ba stop nickel diming spoils could really good business class product already pay quite bit privilege recommend usual caveats,Boeing 777,Couple Leisure,Business Class,London to Barbados,Mar-22,yes
247,247,poor flight cape town london chaos cape town airport passenger handling incredibly long queues get security passport control taking nearly two hours total arrived lounge somewhat frazzled happy find quiet area decent wine appropriate food choices break boarding flight boarding went well seated offered small half full glass champagne captain made announcement say aboard ahead schedule flight time would shorter scheduled unfortunately would mean arrival would early land due 600 lifting overnight jet ban heathrow would wait ground perhaps half hour big deal captain announced due issues heathrow could get compile necessary paperwork would delayed indefinite period delay uncertain duration one might hoped offering champagne beverage particularly business class forthcoming event take permitted quite soon crew distributed menus pa say changes main courses drinks order taken pre dinner drinks main course dinner choice wine dinner drinks nuts served circa 45 minutes take case small measure white wine bottom pleasant decent sized tumbler husband another half glass champagne dinner arrived single tray small measure red wine tumbler food looked bland unappetising tasted cheese two small pieces sitting greasy pool vinegary chutney top wine offered ask second glass provided individualised basis coffee served since hit mild turbulence flight 11 hours duration snacks beverages offered prior breakfast provided separately passenger showed signs awake breakfast slightly edible dinner coffee tea offered individual mug orange juice available request cabin crew largely absent cabin except meal services must said extremely pleasant suitably responsive requests individual items come british airways need better meet customer expectations compete airlines similar routes cost business class ticket passengers enjoying additional space seat comfort flatbed benefit economy ticket 25 price paid premium cabin time flying business class real treat longer case,Boeing 777,Couple Leisure,Business Class,Cape Town to London Heathrow,Mar-22,no
248,248,main complaint limited food served bland barely edible far worst we’ve ever experienced compared airlines used past staff friendly enough rarely seen meals snacks offered flight different every airline used past 14 hours flying breakfast offered tiny cold stale ham cheese roll small plain yoghurt couple oreos ever decide fly suggest bring food certainly return flight never use british airways,Null,Couple Leisure,Economy Class,Sydney to Heathrow,Mar-22,no
249,249,complete utter chaos heathrow yet surely ceo sean doyle must take responsibility step aside consistent continuous problems cause flights cancelled delayed queue first wing check 10am today 1 hour subsequent flight malaga 15 hrs late leaving gate updated delays 3 times strangely one person apologised said sorry ba seems think normal practice nowadays emerald oneworld wish alternative ba become intolerable flying 55 years since beaboac days,A320,Business,Business Class,London to Malaga,Mar-22,no
250,250,feb 25 2022 show airport 3 hours early flight dublin waited line 3 hours check luggage learn flight delayed another 3 hours connecting flight london trying go customs wouldnt let us boarding plane going happening 30 minutes told us wait customer service line well hour found could gone customs connecting flight london dublin delayed hour however time told information doors close next available flight dublin 227 late evening said forced stay night london talking british airways manager informed us ba would reimburse us hotel flight get dublin regardless airline clothes due losing bags excursions transportation due issue spend multiple days shopping clothes lost days booked explore country buy extra suitcase new clothes received went 4 days lost bags finally got home submitted claims like told within days declined asked contact talk somebody declined tried reach via social media get passiveaggressive messages refuse pay back new flight get dublin transportation airport london hotel london clothes buy lost bags 4 days extra luggage fee extra clothes buy customer support impossible get direct response,Null,Couple Leisure,Economy Class,Austin to London via Dublin,Mar-22,no
251,251,british airways process upgrading 777 fleet new club suite ba59 16yrsold packedlikesardines club world product lounge cpt also bursting seams food orders behind many passengers left time food arrived boarding surprised find menu amenity kit bottle water already placed storage drawer suspect another cynical timesaving initiative part ba frustratingly menu turned incorrect replacement dishes probably worst ever encountered business class airline drinks run cancelled without warning spurious basis passenger nut allergy hard avoid suspicions cabin crew economical truth apart rather turbulent ride flight otherwise uneventful arrival slightly ahead schedule baggage handling however atrociously slow,Boeing 777-200,Couple Leisure,Business Class,Cape Town to London,Mar-22,no
252,252,flew funchal madeira yesterday madeira covid restrictions entry yet ba asked us upload nhs vaccination passes could check online received ok hour later husband couldn’t check online arrive heathrow 2 hours departure stood long queue check 3 desks open queue approx 100 travellers several people went breaks disappeared one desk open queue barely moving went complain various ba staff said manager told people coming one blonde lady walked around ages shepherding travellers queue sitting desk another man later likewise making us wonder hadn’t simply worked desks beginning stood queue good hour almost running security queue thankfully moved quickly hurriedly bought sandwich walked departure gate stood bus plane whole experience extremely stressful took best part 2 hours time sit plane completely unnecessary able check online would happened husband’s vaccination pass fine required madeira think systems failure received email yesterday morning saying pass order even though i’d previously told could check online also unnecessary ba staffed desks properly queue would moved staff member told us ba laid lots staff lock begging return treated badly didn’t want flight fine time given bag crisps bottle water fine nothing praise worthy,Null,Couple Leisure,Economy Class,London Heathrow to Funchal,Mar-22,no
253,253,absolutely bad experience british airways two bookings past two years cancelled first one understand covid19 unexpected today got another surprise flight antalya may 2022 cancelled explanation given definitely book ever,Null,Couple Leisure,Economy Class,Gatwick to Antalya,Mar-22,no
254,254,flew ba lhraus 7879 outbound leg back a3501000 return leg seats comfortable staff service inbound leg disappointing safety briefing missed lhraus route lhraus boarding time flight flew time landed time auslhr boarding one hour late left hour late landed one hour late food quality legs fit human consumption wife ordered veg meal served cold legs flight entertainment outbound leg bad 23 screens working return leg worked fine due a3501000 brand new good quality sleep legs good check lhr flawless without incident check aus rotten queued number 4 line waited 1 hour staff check us clear staff quality austin poor passengers appear passenger locator forms ready verifly app ready vaccine detail ready looked business premium economy class legs paying business class premium economy appear worth baggage received fine aus lhr latter took ages return option another airline would fly ba,Boeing 787-9,Couple Leisure,Economy Class,London to Austin,Mar-22,no
255,255,food awful night early morning flight started offer terrible chicken wrap thing terrible went traditional breakfast disgusting sausage inedible hash browns rubbish ba,Null,Couple Leisure,Premium Economy,Dubai to Heathrow,Mar-22,no
256,256,really can’t believe audacity call first class check staff singapore abrupt unhelpful official ba lounge singapore closed they’re using cheap generic alternative anyone pay twenty pounds go suffice say pleasant onboard like middle bad comedy sketch believe two stewardess ever first class training ask slippers first drink took nearly hour arrive despite 8 passengers serve two poor woman sat next ordered wine came filled brim mean it’s first class student house party neither knowledge wines menu food awful steak dry cooked tough whichever catering manger signed canapé soggy mushroom top chunk polenta sacked immediately say cheese port nice however worst thing constant galley noise cart stowage immediately front seat 1k night appeared incapable shutting without slamming also seemed stored personal belongings bin immediately seat we’re well say seat well designed personally i’m happy club would never first,Boeing 787-900,Solo Leisure,First Class,Singapore to London,Mar-22,no
257,257,london dubai family 6 kids 10 6 years old savvy travelers many holidays excited ba first time disappointment became desperation eaten anything since dublin morning 7am time eat lhr thought well get something usually around 1 hour flight 35 hours take served food food fine nothing special issues beverage attention kids youd expect many airlines even kids book would good movies outdated already watched overall medium experience,A350,Family Leisure,Economy Class,Dublin to Dubai via London,Mar-22,no
258,258,one would think number crises ba incurs would emergency planning fine art last flew ba may 2017 yes weekend last one crisis swore never ended purchasing ticket aug 2018 bologna ba cancelled flight covid hit ended voucher fast forward feb 26th 2022 received message 530am 30mins lhr flight cancelled arrived airport everyone else wandering seeking answers staff either told go online bit difficult ba systems ring ba ha ha go home helpful live two hours lhr miracle app sprung life managed get one last 10 seats evening flight sat arrivals coffee shop soon ran seats 1200 midday us trying get airside use lounges one allowed departures two hours prior flight supposedly crowds pointed ba provided refreshments told put claim eventually got departures made security ba customer services note oxymoron consistent queue 20 people ba still cancellingrearranging flights passengers airside boarded flight 45mins late sat tarmac pilot told us delay trying reconcile luggage took given one small bottle water cereal bar fivehour flight purport topclass airline fact ryanair finesse staff fine miserable treated badly like remind best difficult situation well passengers aircraft cramped worn reluctant use egyptair flew home new aircraft good entertainment system provided hot meal snack price ba ticket earth ba justify prices management sacked ultimately blame ruination airline,Null,Couple Leisure,Economy Class,London Heathrow to Cairo,Feb-22,no
259,259,never use ba long haul flight experience flight lhrmle wasn’t bad apart screaming child return wasn’t good experience weren’t provided drink boarded forgotten happened times flight think crew premium economy young experienced leaving experienced ones businessfirst actually think ba care businessfirst customers cabins getting larger classes ran food choice 8 rows back cabin it’s large cabin ran wine straight food service food 7hrs apart couple biscuits one go get kitchen weren’t fed 15hrs landed 115hr flight soggy roll containing 2 slices cucumber 2 slices tomato ba don’t care anymore little people,Null,Couple Leisure,Premium Economy,Male to London,Mar-22,no
260,260,british airways getting worse worse flight 8 mins late luggage taking hours arrive communication whatsoever anyone cant reached phone answer delays emails app crashing times change aircraft without notice even pay seat staff say nothing,Null,Business,Economy Class,Copenhagen to London,Mar-22,no
261,261,paid 3 business class seats london new york got downgraded airport check overbooked business class couldn’t even provide compensation refund told call customer service submit form unbelievable unacceptable never,Null,Family Leisure,Premium Economy,New York to London,Mar-22,no
262,262,absolutely shambolic customer service lounges heathrow outdated service terrible waited hour chosen fooddrink order brought ended getting told board product average,A321-neo,Business,Business Class,London Heathrow to Sofia,Aug-21,no
263,263,flight back athens different airline delayed causing us miss first flight home understand required help due delayed flight different airline whats worse went ahead canceled tickets connecting flight would able make based another flight found causing us buy much expensive tickets home resulted us overnight layover buy hotel room top ridiculously expensive last minute tickets absolute worst customer service ever dealt never flying,Null,Family Leisure,Economy Class,Athens to Boston via London,Oct-21,no
264,264,flight took two hours late described shambles airport airbridge aircraft acceptable aircraft better outbound flight screen small serving 23rd cabin first choice vegetarian dish chicken dish economy cabin airline must know vegetarians order meal include choice also offer roll hamcheese breakfast 12 hour flight cost saving hot breakfast offered 90 minutes connecting flight due late arrival made staff aware whilst let others passengers flight first staff assist getting us flight struggle get connecting flight arriving glasgow got txt say bags make flight first time using ba premium likely last,Boeing 777,Solo Leisure,Premium Economy,Cape Town to Glasgow via London,Feb-22,yes
265,265,mistake booking made ba got email say contact us discuss took 30 contact attempts spanning 7 hours still resolved absolutely shambolic customer support ever experienced still waiting call back promised 2 weeks ago,Null,Business,Business Class,Bangalore to London,Mar-22,no
266,266,economy cabin surprisingly underpopulated flight 30 passengers business class threequarters full boarding therefore mercifully quick takeoff schedule sadly ba59 makes use old club world product seems like step back time experiencing new club suite ba4243 good points old club world drawer capable taking laptop comfortable seat flat embarrassment tiny poorly responsive screen almost beyond belief service perfunctory meal service conformed current overly cautious postcovid requirements everything served time mean meal done relatively speedily lacklustre experience contrast bas competitors smacks continued costcutting queues three toilets business class unacceptable times limited attention paid keeping clean arrival schedule covid paperwork processing meant hour able collect baggage,Boeing 777-200,Couple Leisure,Business Class,London to Cape Town,Mar-22,no
267,267,british airways continues go downhill flew business class experience like economy 20 years ago except glass champagne packed full 3x3 seats issue day even weren’t seat pitch width economy gone little pretend tables middle seat give illusion style food dreadful flight service unsophisticated ba used acceptable european business class don’t european airlines offer much better flight experience business class comparison ba taking premium frequent flyers granted treating us like mugs miss politeness old ba business class around 5 years ago used look forward small gestures like hanging coat giving hot towel nice food served galley rather manky trolley covid reason years cost cutting result dreadful,A320,Couple Leisure,Business Class,Lisbon to London,Feb-22,no
268,268,outstanding warm smiling welcome board flight excellent flight crew friendly attentive professional detailed announcements flight deck well food wine good indeed premium economy product ba also good comfortable seats foot leg rests decent recline fr superior airline atlantic routes,A350,Solo Leisure,Premium Economy,Vancouver to London,Feb-22,yes
269,269,british airways scrapped mandatory wearing face masks onboard flights although pretend publicly policy remains ba454 london malaga 25th february across 6 visible rows around 7 24 passengers wearing face masks one long meal drinks service cleared remained like landed deplaned cabin crew frequently aisles word said non compliant passengers left aircraft staff bidding farewell guess scared remind people follow rules,A320,Business,Business Class,London to Malaga,Feb-22,no
270,270,ba got wrong 6 hours delay food voucher 4 pounds information advice staff serve waiting passengers attitude towards passenger one dispensable commodity,A322,Business,Economy Class,London to Athens,Feb-22,no
271,271,another episode unmitigated shambles comes customer service day storm eunice english half term holidays getting underway make allowances accept could delays fact compounded late cancellation raft flights domestic european destinations evening saturday 19 february operational reasons pitiful could rebook via ba’s website instead passengers compelled queue gate a17 lhr possibly rebook provided accommodation overnight ba cabin crew helpful customer services south lounge simply directed passengers ever growing queues a17 disgrace,Null,Solo Leisure,Economy Class,London to Edinburgh,Feb-22,no
272,272,check iad quick easy lounge washington ba lounge good sound pre flight food offerings overnight flight flight time boarded promptly eaten opted sleep full dinner breakfast service wanted slept well time arrival quickly made t5 arrivals lounge excellent,Boeing 787-9,Family Leisure,Business Class,Washington to London,Feb-22,yes
273,273,old planes poor food minimal leg room economy check procedure online work fellow travellers special meal request given weeks advance food allergy ignored spoke ba customer service representative soon landed heathrow said could help referred telephone line said referred online complaints form trying weeks raise concern food allergies prevent happening others reply via complaints website twitter telephone hotline also currently unavailable,Null,Couple Leisure,Economy Class,Accra to London ,Jan-22,no
274,274,booked ba return flight one hour way club class paying 700 euro 2 persons asked pay 96 euro choose seats business full business class ticket fee seat disengaged management model,A320,Business,Business Class,Dublin to London,Feb-22,no
275,275,ba got everything right allowed evening check allowed lots time staff help paperwork needed travel us day travel half term airport busy spite security lounge 5 minutes lounge clean staff proactive food served quickly good range drinks easy transfer c gates aircraft ready boarding quick well organised pre departure drinks served cabin crew excellent provided good service food new club world menu options roast beef excellent although older club world product clean well maintained time arrival baggage fast overall excellent flight feels like ba improving offering time many providers use covid excuse service cut backs well done,Boeing 787-9,Family Leisure,Business Class,London to Washington,Feb-22,yes
276,276,appalling customer service cancelled flights rebooked us confirmed change hotel reservation part inclusive booking hours hours telephone response get recorded message say cant take call dont respond emails sent complaints line,Null,Family Leisure,Business Class,London to Porto,Feb-22,no
277,277,past novemberdecember flew washingtonlondon return strength trip first two years inflight service quality appears pretty much returned prepandemic status quo ante cabin clean well maintained seats comfortable food drinks good including tasty hertfordshire roast pork return leg ba cabin crews remain best business one number bookings rebook number times due flight cancellations contrary experience many rebookings handled courteously thoroughly although number lengthy waits hold present circumstances thats expected good see everyday product held well amid dreadful time im looking forward future trips ba,Null,Solo Leisure,Business Class,Washington to London,Dec-21,yes
278,278,best experience ever airline initial flight dubai canceled royal air maroc find new flight last minute found booking extremely simple unfortunately cancel flight day departure called customer service waited 20 minutes could speak someone within 15 minutes flight canceled offered full refund person line extremely nice understanding willing help us never dealt nice employee airline got full refund credit card day usually chose cheapest flight ticket regardless airline i’ll definitely make sure check british airways first,Null,Couple Leisure,Economy Class,Montréal to Dubai via London,Feb-22,yes
279,279,ba cancelled original return flight rebooked us day later issue enjoyed extra days holiday others might flexible however overlooked rebooking connecting flight lhr fortunate still space flight checked atl aircraft newish excellent condition flight around 50 capacity service excellent staff friendly efficient dinner good breakfast disappointing little choice lhr bhd leg equally good beginning think ba getting mojo back,Boeing 787-9,Couple Leisure,Business Class,Atlanta to Belfast via Heathrow,Jan-22,yes
280,280,boarding slow uncomfortable account lack aircon gate club suite cabins 34 full rest plane cant much 20 occupancy whether reason cabin crew flight cut bare minimum hard say certainly work hard covering multiple cabins despite drink food service business efficient current policy serving courses meant dinner done dusted two hours takeoff real bonus nighttime flight however quality food remains mediocre best pasta dish almost inedible club suite big improvement ancient cw product although storage funny arrangement tiny compartments invite losing smartphone two one definitely misses drawer foot level old cw large screen really improves viewing experience whole ife system much responsive new seats dont significantly aid sleeping particularly theres obvious ridge level base spine waking two hours touchdown definitely recommended order get breakfast avoid usual queues toilets performance flight deck usual high standard arrival twenty minutes ahead schedule progress border control speedy baggage collection delayed unspecified reasons overall good flight,Boeing 777,Couple Leisure,Business Class,Cape Town to London Heathrow,Jan-22,yes
281,281,unfortunately flown new club world cabin time incredibly old plane good cabin crew tried make trip pleasant possible bad inflight entertainment screens unwatchable worked wife’s didn’t post ipad era don’t live food okay without anything special served apparently crew explained shortage staff i’m afraid ba lot regain standing aviation world competition fierce sit laurels,Boeing 777,Couple Leisure,Business Class,London Heathrow to Orlando,Jan-22,no
282,282,utterly appalling company weve flown two times times disaster first time return flight delayed 24 hours nobody gate tell us large group passengers roam round dubai airport looking ba staff none eventually another airline told us go unmarked stairs angry person told us fault given letter letter put us bus terminal arrived nobody greet us literally left yet contact another airline managed find us transport hotel got told full couldnt choose rooms given terrible dirty cramped room several times throughout night called tell us flight moved eventually got board next day tray table broken window blind didnt get meal compensation offered second time need reschedule flight website assured fine provided link needed phone need phone ba dont even bother trying never got speak anyone ended booking hotel wait flight rather rescheduling food terrible meagre portions given infrequently sandwich inedible,A380,Couple Leisure,Economy Class,London Heathrow to Dubai,Jan-22,no
283,283,past 2 years flown british airways twice ended exact predicament wait around day london heathrow 1 hour flight home newcastle holidays plane staff fantastic customer service staff heathrow useless first time february 2020 got stuck heathrow due storm ciara travelling home work airlines fault however handling situation staff airport joke 4 5 staff ran kiosk queue 100 unhappy travellers whilst could set mini kiosks unused gates get everyone quicker crowd control one point queuing 2 hours plus staff decided shut shop end 12 hour battle lucky enough get home last flight day sheer luck finally spoke someone november 2021 decided give ba second chance booked go new york since plane landed late lhr missed connecting flight could avoided staff heathrow assisted held plane short rushed customs manage make gate 5 minutes spare plane still terminal since taken luggage flight told go service desk refused let since moved later flight layover 10 hours got guest services £12 food voucher spend phone number thought complaints hold 20 minutes found complaints considering fact could avoidable assistance given food voucher £12 seemed really cheap days got home raised complaint expressing annoyed waited month response chasing find complaints staff working got response said wanted 2025 back holiday got apology told staff heathrow better terms good compensation offered nothing,Null,Solo Leisure,Economy Class,New York to Newcastle via London,Nov-21,no
