,Unnamed: 0,reviews,aircraft,Type of Traveler,Seat Type,Route,Date,Recommend
494,494,austin london along 1900 purchase price two roundtrip tickets wife daughter ba charged additional 250 seat reservations ensure sat together went check seat reservations directions given away family sit different seats back home applied refund 250 seat fee told proof paid credit card charges email confirmations clearly stating charges made process upload documents ba,Null,Family Leisure,Premium Economy,Austin to London,Oct-19,no
495,495,frankfurt london british airways awful airline put wife opposite ends plane even though booked together gave middle seat even though many others free childish airline charges premium goes make journey difficult dont book biz class avoid,Null,Couple Leisure,Economy Class,Frankfurt to London,Dec-19,no
496,496,london glasgow british airways flight delayed it’s like it’s one it’s delayed every week like bad joke really poor yet expensive airline wouldn’t recommend traveller,Null,Solo Leisure,Economy Class,London to Glasgow,Dec-19,no
497,497,london san francisco flight delight friendly relaxed crew good food wine main deck club world cabin nearly empty manage expectations ba club world everything goes shouldnt disappointed yes rollout new club world suite long time coming however food service improved considerably ba trying valiantly regain long gone moniker worlds favourite airline 747 seen better days however given theyre removed airlines passenger services take opportunity fly one theyre gone im gradually regaining confidence ba,Boeing 747-400,Business,Business Class,London to San Francisco ,Dec-19,yes
498,498,heathrow belfast great service belfast absolutely shocking t5 heathrow rude check staff told print boarding passes also suitcases totally disgusted cabin crew lovely 1240 flight belfast 9th december,A319,Couple Leisure,Economy Class,Heathrow to Belfast,Dec-19,no
499,499,london singapore apprehensive flying ba club world reading many negative reviews however surprised firstly part sq qr fair found one reasonably priced offerings get pay seat old perfectly comfortable plenty space window seats best privacy tall issues sleeping fact slept almost 7 hours service food london top notch fresh plentiful welcome contrast tiny meals receive qantas service consistent polite attentive drinks water continually topped truly impressed return flights service average quite sloppy let’s focus positives,A380,Solo Leisure,Business Class,London to Singapore,Oct-19,yes
500,500,toulouse london im able bodied fit ba customer silver member seated emergency exit seat id put away items fastened seatbelt full compliance regultions cabin crew member came row point security exit safety card listening responding despite ordered take cabin pressure equalizers called earplugs explained needed keep protect ears doors already closed suffer ear problems fly told could hear perfectly demonstrated vocal exchange despite kept talking threatened remove seat fail follow order begrudgingly took ordered removed seat pointed already asked speak purser came see take told cabin crew member unnecessarily rude needed customer care training indeed look new job wrote british airways complaint even bothered respond awful rude airline,Null,Business,Economy Class,Toulouse to London,Nov-19,no
501,501,london heathrow stockholm business class shorthaul seats economy one sitting middle seat get served drinks food proper gin gt good food,A319,Solo Leisure,Business Class,London Heathrow to Stockholm,Nov-19,yes
502,502,johannesburg london limited recline seats 11 hour overnight flight checked asked told good seats completed complaint asked ba thought ok come representatives allowed lie never flying ba,A380,Family Leisure,Economy Class,Johannesburg to London,Nov-19,no
503,503,johannesburg london recently refurbished first club world lounge jnb failed resolve congestion passengers two evening flights lhr descend theres table space eating food improved poor acoustics mean intrusion privacy crying babies facetime calls add restless maelstrom human activity boarding reasonably quick although usual confusion group queues predominantly young mixed fleet crew competent lacked finesse kept getting drinks orders muddled meal service took ages unidentified problem heating main course food wasnt bad finally served cabin temperature wasnt hot slept quite well arrival ten minutes ahead schedule baggage collection quick overall good flight despite aged club world product,A380,Couple Leisure,Business Class,Johannesburg to London,Dec-19,yes
504,504,london heathrow miami flying boeing 747400 unfortunately ba hasnt done much work first class aircraft seats flat bed wedge front even 61 makes beds small since narrow feet get clamped sleep side seats business class example qatar airways still think first class ticket include wifi always service excel crew friendly helpful meals impeccable,Boeing 747-400,Solo Leisure,First Class,London Heathrow to Miami,Nov-19,yes
505,505,stockholm london heathrow always ba works excellent service ground air still good gin aboard decent gt even meals business looks like came 90s economy taste great,A319,Solo Leisure,Business Class,Stockholm to London Heathrow,Nov-19,yes
506,506,london sydney via singapore flight left time cabin crew fantastic meals great leaving london chicken stir fry landing singapore 1800 served english breakfast eat time day wife thought bit odd singapore passengers disembark aircraft refuelled clean reboarding go security check gate ground singapore 1hour 30min 2nd leg sydney great also food drink service great 23 hours long haul flight comfortable exit row seating entire flight recommend anyone 6ft tall,Boeing 777-300,Couple Leisure,Economy Class,London to Sydney via Singapore,Nov-19,yes
507,507,london new york jfk booked brussels airlines two us cancelled flight rerouted us ba flight bru london fine transatlantic leg heathrow airport terminal 5 utter nightmares never go heathrow however review bas 747400 jfk aircraft sorry state junked years ago ba gall call service business class seats tiny wrapped plastic chicken coop partitions rattled even fell several occasions let add faced backwards looked filthy wall cabin service friendly food actually quite decent aside understand ba horrendous welldeserved reputation never,Boeing 747-400,Couple Leisure,Business Class,London to New York JFK,Nov-19,no
508,508,first thing shortage staff business cabin quite large eight across seem serviced one two people side meant drink takeoff appear hour order taken unfortunately although pleasant staff mark appeared undertrained asked young man turn reading light claimed werent showed one seat fiddling said must broken end flight discovered switch despite newly configured plane dividing screen kept dropping ask cup tea 3 times choice two reds two white wines considering number people business section cannot understand would offer third port menu never offered cheese every time next course came setting ready accept due plates glasses previous course many people clutter uncleared hour end meal courses quite small portions end meal ready mini snack big eater peckish layout business cabin cramped 6 could stretch seats legroom extremely narrow people centre two rows window seats climb passengers means one easy seat either climb climbed wonder expect bad design accepted business market travel many airlines business ba still bottom pile reluctantly last one would use centre window seats food drinks served effectively service hatch across customers unfortunately upon arrival bridgetown ba team didnt get better one hour 25 minutes waiting fast tracked luggage approached guy wearing ba tabard shrugged shoulders found another guy worked ground staff went outside found 25 cases sitting tarmac nothing,Boeing 777-200,Solo Leisure,Business Class,Gatwick to Bridgetown,Dec-19,no
509,509,brussels bangkok via london club world london bangkok 17 nov 2019 seats 15c 15d boeing 777 242 seat configuration business cabin gives cabin crowded impression seats comfortable flat bed mattress good selection entertainment although rather small screen food menu offers different choices starters main course desserts food disappointing smoked salmon starter british beef main course soup cold mybeef overcooked quantity economy classlike service friendly personal i’m used adressed name fly business class serving meals forget serving wine amount cabin crew enough crowded business class cabin dinner went sleep seat turned real bed extra mattress good pillow space narrow difficult make bed bed made place put personal stuff real good night sleep though seat aisle step someones legs go toilet toilets small simple cleaned frequently enough woke breakfast service running breakfast good yoghurt pastries fresh fruit full english breakfast overall british airways world club rather standard business class lacks personalized attention lacks feel good experience ba wants compete long way go hope make bit return flight,Boeing 777,Business,Business Class,Brussels to Bangkok via London,Nov-19,no
510,510,san francisco oslo via london head support damaged sit 10 hours leaned forward flight san francisco delayed missed connecting flight london oslo came first ba counter received new flight 3 hours 15 minutes later rude staff gave voucher 15 gbp,Boeing 777-200,Business,Economy Class,San Francisco to Oslo via London,Nov-19,no
511,511,connection flight london berlin traveling hand luggage got automatic boarding gate man gate said need check baggage right grab passport boarding pass flight full check overhead lockers arent things put seats fits hand luggage flight arrived berlin 7 minutes late,Null,Couple Leisure,Economy Class,Los Angeles to Berlin via London,Nov-19,no
512,512,london johannesburg british airways ba’s b gates lounge rather civilised place pass time galleries lounges main terminal it’s also tad closer transit via rather useful walkway level 4 c gates a380s depart new boarding groups meant snaking queues least group 2 moved fairly speedily club world still much maligned seats small unresponsive ife screens limited selection films dinner service slow unwise introduction individual trays brought seat trolleys may lack glamour one get sleep quicker overnight flight breakfast adequate nothing landing exactly time overall reasonable flight inflight service distinctly average,A380,Couple Leisure,Business Class,London to Johannesburg ,Nov-19,yes
513,513,london bangalore flight bangalore london 10 november 2019 delayed 4 hours resulted missing connection flight return london bangalore initially delayed 15 hrs assigned boarding gate waiting gate 30 mins announcement made flight delayed 4hrs 27mins due maintenance,Null,Business,Premium Economy,London to Bangalore,Nov-19,no
514,514,london sydney via singapore would like express thanks appreciation staff bag drop centre heathrow lost passport thursday evening 21st november spent nearly 2 hours trying locate eventually found 30 mins flight due leave big thank would also like thank cabin crew flight ba0015singapore sydney 22 november kind taken ill flight looked well,Null,Solo Leisure,Economy Class,London to Sydney via Singapore,Nov-19,yes
515,515,lisbon london pay extra check bag ensure using share overhead space british airways charge 50 euros check bag final destination insist briefcase put seat cramped aircraft ensure room overhead bin travelers cheap check bags insult never fly ba,Null,Solo Leisure,Economy Class,Lisbon to London,Nov-19,no
516,516,ba operate daily shuttles london glasgow busy route im sure make money plus competition however ba flights rarely time fee paying passengers fed stories aircraft delayed enroute far flung exotic location several buses trains catch reach glasgow punctuality means lot lot ba hence im disappointed service provide,Null,Solo Leisure,Economy Class,London Heathrow to Glasgow,Nov-19,no
517,517,doha london surprisingly good flight ontime departure early arrival 30min attentive friendly crew especially towards children food halal since doha clearly announced passengers bag arrival ok seat leg room entertainment beyond expectation,Boeing 787-9,Family Leisure,Economy Class,doha to londonDoha to London,Nov-19,yes
518,518,london buenos aires paid extra top holiday cost fly direct flight firstly cancelled flight months departure meaning go day earlier pay extra night hotel plane old cramped making difficult get walk around 14 hour flight entertainment system pathetic much film choice random selection tv programmes games drinks service lacking food awful snacks offered long haul flights comfort packs toothbrushtoothpaste etc offerings,Null,Family Leisure,Economy Class,London to Buenos Aires,Nov-19,no
519,519,san francisco london a380 wonderful aeroplane movie selection average staff polite fist time used call button midflight response fast second occasion repeatedly ignored call button 45 minutes don’t see acceptable,A380,Couple Leisure,Economy Class,San Francisco to London,Nov-19,no
520,520,sydney singapore british airways packed like sardines tin disappointment airline pack even getting seat debacle due cramped nature flight configuration awkwardly stare fellow guests sit right opposite trying lock gaze seat close aisle times felt like people walking get past narrow passage ways would could recommended airline seats best premium economy,Boeing 777-300,Business,Business Class,Sydney to Singapore,Nov-19,no
521,521,london mauritius fortunate enough flown many different airlines including low cost carriers also upper class cabins premium airlines without shadow doubt whole british airways experience poorest aeroplanes seats general service experience importantly poor customer service following bad flight truly feel airline deserves go bust truly disgraceful approach service product deliver begrudge flying given option always choose different airline,Boeing 777,Family Leisure,Economy Class,London to Mauritius,Nov-19,no
522,522,los angeles amsterdam via london due delayed take risked missing connecting flight thanks excellent premium host service julie colleague managed time thank much,Null,Business,Business Class,Los Angeles to Amsterdam via London,Nov-19,yes
523,523,london vancouver used fly aircraft route many years longer priced competitively flew 14th remarkably bad experience food service poor aspects chicken tandoori far spicy palettes drink offered meal astonishing rather tea coffee obviously far cheaper offering supplied soon dinner tray handed ask twice beer deliveredthis put sync service one time yes one time offer tea coffee obviously missed completely service good warmth hospitality 9hr flight engagement pretty critical hostesshost seemed interested sitting extra legroom seats essentially ignored everyone else cold snack cold tasteless sandwich prior landing entertainment system joke old become accustomed normalnewish tv screen blown away system still place screen size equivalent phone’s music selection worth talking used ipad similar routes flown air canada westjet virgin atlantic air transat ba far worst airlines budget nature offer paid meals cannot believe mighty ba offers terrible product 2019 spend fly better actively avoid ba long haul,Boeing 747-400,Solo Leisure,Economy Class,London to Vancouver,Nov-19,no
524,524,flight departure delayed due captain described announcement mix paperwork disembarkation delayed due also described mix landing bridge allocation plane taxi around runway gate found missed connecting flight staff purple airport supposed help passengers find connecting flights didn’t know ended shunted onto another flight resulting four hour delay inconvenience due ba’s incompetent management seat would recline food carbohydrate filigree flight attendants rude used good airline,Boeing 747-400,Couple Leisure,Economy Class,New York to Paris via London,Nov-19,no
525,525,london heathrow lisbon mediocre flight smooth arrived time cabin service left great deal desired staff seemed going motions bread roll offered meal service despite requesting glass wine accompany meal forthcoming staff required ‘nudge’ delivered great club europe experience,A320,Couple Leisure,Business Class,London Heathrow to Lisbon,Nov-19,no
526,526,london boston comfortable flight economy class food fairly good ways dinner evening flight west returning night flight east got solid sleep flight back,Boeing 777,Solo Leisure,Economy Class,London to Boston,Nov-19,yes
527,527,tirana london gatwick fly british airways around six times month thanks work almost always pleasant experience past flight definitely outdid others boarded departed exactly time friendly welcoming crew flight fully booked travel companion lucky one sitting row could empty middle seat therefore space best surprise flight far availability wifi never british airways flight within europe fact wifi package got included texting unlimited incredibly fast good home connection truly made flight enjoyable allowed continue business even flight extremely valuable something british airways improve would leg space flight noticed particularly tight although common problem 188 cm tall also unknown reasons food snacks served 2 hours 45 minute flight drinks slight struggle skipped breakfast managed well flight however arrived ahead schedule deboarded quickly always recommend ba continue,A320,Business,Economy Class,Tirana to London ,Nov-19,yes
528,528,gatwick st lucia great service flight thank much cabin great cabin crew excellent service,Boeing 747-400,Solo Leisure,Economy Class,Gatwick to St Lucia,Nov-19,yes
529,529,london singapore commend ba staff occasion friendly welcoming accommodating passengers throughout flight even last moments laughing joking us highly professional sensitive needs despite tiredness thank ba making long journey tolerable one,Null,Family Leisure,Economy Class,London to Singapore,Nov-19,yes
530,530,london san francisco return economy seats small outbound bearable empty seat two us returning empty seat horrible im 55 female couldnt lean seat front collect belongings want get anything bag seat front need major maneuvering touching person next throughout flight unavoidable flew 747 ways longer air vents adjust flights got stuffy warm ask turn ac ways literally sweating economy small aircraft mostly made business class asian vegetarian meal good usual although breakfast terrible asian vegetarian breakfast economy plus much better find alternative airline long haul flights worth,Null,Solo Leisure,Economy Class,London to San Francisco,Nov-19,no
531,531,gatwick venice flown route class two occasions pleased aspects recent trip mobility issues check operator immediately suggested assistance service welcome efficient particularly gate distant one flight departed time cabin staff pleasant food good flight information flight deck good landings noticeably smooth return journey similarly good satisfied,A320,Couple Leisure,Business Class,Gatwick to Venice,Sep-19,yes
532,532,bordeaux gatwick british airways cancelled september 11 flight due pilots strike advance notice made alternative travel arrangements confirmed wanted cancel end order receive refund received confirmation ba 24 august 2019 ba refunded fare soon enough still awaiting refund 70 euro cost baggage paid six weeks later lodged complaint 9th october action lodged another complaint 25th october still action cancelled flight wont refund money call customer service,Null,Couple Leisure,Economy Class,Bordeaux to Gatwick,Sep-19,no
533,533,seychelles london day time flight back london staff welcoming greeted entry aircraft shown seats 7 jk best seats couple book away toilet front cabin window k seat direct access aisle ontime departure swift meal services nothing trouble flight full easy access club kitchen meal service great entertainment found flight great love inbound day time flight london easiest travel seat screens worked great problems loved every minute flight big thank staff fantastic looking forward next flight rio december,Boeing 787-9,Couple Leisure,Business Class,Seychelles to London,Oct-19,yes
534,534,london belfast british airways bullied parents spoilt special occasion booked parents ba attend investiture palace mother heart attack 3 months ago first flight post recovery chosen ba expecting best level service instead treated appallingly felt bullied airline staff mother suffers claustrophobia always requests aisle seat booked parents 2 aisle seats side side printed boarding passes seats 24c 24d arrival checkin one boarding passes recognised scanner assistance printed new one going security boarding pass recognised new pass printed parents arrived gate noticed one seats changed father explained situation rep checkin started quoting ‘geneva convention’ ba contracted get b could change seats wanted waiting gate try resolve situation eventually 5 minutes airborne rushed aircraft forced sit apart care welfare circumstances stage receive apologetic words someone recovering heart attack unnecessary stressful event spoilt special family occasion holding hope bas slide grace halt seem constantly disappointed await bas response parents know fly carrier handing back ba amex points appropriate apology issued update summary don’t trust ba loved ones care,A320,Couple Leisure,Economy Class,London to Belfast,Oct-19,no
535,535,london cape town booked business class tickets year advance trip africa usually fly star alliance picked ba segment better connection timing london cape town huge mistake tried reserve seats ba website twice able tried call ba twice gave hold hour time call back option arrived today london toronto connections desk seven hours flight told business class oversold would downgraded premium economy ba’s representative told us reserved seats bottom list business class loyalty customers would priority seats us would still welcome lounge bonus problem us clear security get lounge since could print boarding passes due grade took close hour get settled lounge time first arrived connecting desk asked speak manager four interactions ba staff told would get speak us giving impression trying pass unhappy customers fast could one point got visibly frustrated ba staff issuing new boarding passes indicated grade voluntary definitely two half hours ba customer service managers came speak us first ones actually apologetic tried address situation customer oriented perspective british airways think giving bulkhead seats premium economy basic lounge access paying business class passengers adequate customer service downgrade paid business fare upcoming overnight flight booking flights ba,Null,Business,Premium Economy,London to Cape Town,Oct-19,no
536,536,san jose london tv screen 12f broken could locked position would allow watch movies flight attendants could fix suggested move different seat slipped purpose checked back seat front dirty tray 12d moved hole right side tv screen sensitive enough operated touch although husband 12e turned breakfast cards together flight attendant insisted don’t planning wake serve breakfast flight attendants best seems understaffed,Boeing 787,Couple Leisure,Business Class,San Jose to London,Oct-19,no
537,537,london heathrow edinburgh boarding efficient flight full passengers asked volunteer check hand luggage would get priority boarding took offer laptop carried plane aircraft two months old sat back plane 36 f sure ryanair room british airways aircraft offering ultra low cost service cloak legacy carrier legitimacy,A321neo,Solo Leisure,Economy Class,London Heathrow to Edinburgh,Oct-19,yes
538,538,flight gatwick barbados check business lounge good looks like added champagne self service drinks positive breakfast good flight left time boarding well run flown economy cabin seems ok new configuration come panasonic ife system way better old rockwell collins systems food fine service friendly,Boeing 777-200,Family Leisure,Economy Class,Gatwick to Barbados,Oct-19,yes
539,539,supposed flight bumped icelandair flight rebooked onto ba direct toronto london heathrow tried get changed supposed fly gatwick flight quite good service fantastic chicken tikka masala tasty crew onboard friendly flight time landing amazingly smooth,Boeing 777,Couple Leisure,Economy Class,Toronto to London,Oct-19,yes
540,540,travelling jeddah london bag arrive 1 hour 30 minutes earlier check counter closed tried best staff help leave bag allowed take bag plane london made complaint saying can’t thing get customer service phone call takes 1 hour 47 minutes wait,Null,Solo Leisure,Economy Class,Jeddah to London,Oct-19,no
541,541,zurich london return legs travelled hand luggage could choose seat without paying fair enough 3 empty rows either side 3 strangers cramped one row allowed spread paid premium price seems mean say least hand luggage fares last board make uncomfortable board free food drink,Null,Business,Economy Class,Zurich to London,Oct-19,no
542,542,san francisco london efficient check friendly agent offered upgrade first 760 per person declined refurbished lounge spacious comfortable nice selection snacks boarding time could better controlled flight left landed ahead schedule flight attendants excellent food vastly improved compared last trip business class cheap excellent flight complaints,A380,Couple Leisure,Business Class,San Francisco to London,Oct-19,yes
543,543,london belfast check fast efficient using ba terminal5 first class check security area really good straight lounge great selection food drinks early morning really like ba boarding process ieby group numbers onboard service quality breakfast served excellent overall happy short flight ba,A319,Solo Leisure,Business Class,London to Belfast,Oct-19,yes
